fecha,imagen,nombre,precio
2023-03-30 16:08:34,,,
2023-03-30 16:08:34,https://m.media-amazon.com/images/I/61JNPqSDvdS._AC_UY218_.jpg,Davines Champú - 280 ml,"20,90 €"
2023-03-30 16:08:34,https://m.media-amazon.com/images/I/71XAYvBZTkL._AC_UY218_.jpg,Davines Heart Of Glass Silkening Champu 250 Ml,"18,99 €"
2023-03-30 16:08:34,https://m.media-amazon.com/images/I/61R0Gfz7SoL._AC_UY218_.jpg,Davines Champú Love Smoothing - 250 ml,"19,88 €"
2023-03-30 16:08:34,,Charlemagne Spray de Sal Marina para el Cabello - Spray de Agua Salada - Sea Salt Spray hair Men - Spray de Volumen Textura para el Cabello - Spray de Agua Salada Mate - Spray Ondas de Playa,
2023-03-30 16:08:34,,,
2023-03-30 16:08:34,https://m.media-amazon.com/images/I/71hXwUbVknL._AC_UY218_.jpg,Davines love lovely curl enchancing shampoo (for wavy or curly hair) 2.,"20,70 €"
2023-03-30 16:08:34,https://m.media-amazon.com/images/I/71kMQxQ4VHL._AC_UY218_.jpg,Davines Naturaltech Replumping Champú 250 ml,"19,89 €"
2023-03-30 16:08:34,https://m.media-amazon.com/images/I/614MHILl3bL._AC_UY218_.jpg,"Davines Volu - Champú, 250 ml","18,80 €"
2023-03-30 16:08:34,https://m.media-amazon.com/images/I/71eQCAdLgUL._AC_UY218_.jpg,Davines Oi OIL Absolute Beautifying Potion 135 ml,"41,40 €"
2023-03-30 16:08:34,https://m.media-amazon.com/images/I/61VFtW881fL._AC_UY218_.jpg,"Davines Momo - Champú, 250 ml (881-42109)","18,80 €"
2023-03-30 16:08:34,https://m.media-amazon.com/images/I/51tqI4Llw6L._AC_UY218_.jpg,"Davines Minu - Champú, 250 ml","18,80 €"
2023-03-30 16:08:34,https://m.media-amazon.com/images/I/81rSIbr2v9L._AC_UY218_.jpg,"Davines 69230 - Champú, 250 ml","21,40 €"
2023-03-30 16:08:34,https://m.media-amazon.com/images/I/41cxszUCo6L._AC_UY218_.jpg,Davines LOVE CURL Conditioner 250ml - Acondicionador elastificante y controlador para cabello ondulado o rizado - New Pak 2022,"21,79 €"
2023-03-30 16:08:34,https://m.media-amazon.com/images/I/71wmKzvGLML._AC_UY218_.jpg,Davines naturaltech shampoing energizing 250ml.,"21,40 €"
2023-03-30 16:08:34,https://m.media-amazon.com/images/I/51B+6TcPl0L._AC_UY218_.jpg,davines nourishing naturaltech shampoo 250 ml,"19,78 €"
2023-03-30 16:08:34,https://m.media-amazon.com/images/I/61eQxA53VLL._AC_UY218_.jpg,Davines Essential Nounou Mask 250 Ml - 250 ml,"23,90 €"
2023-03-30 16:08:34,https://m.media-amazon.com/images/I/81rPSzWE1YL._AC_UY218_.jpg,Davines naturaltech renewing shampoo 250ml - champù de longevidad todo.,"19,89 €"
2023-03-30 16:08:34,https://m.media-amazon.com/images/I/61PkAII-MvL._AC_UY218_.jpg,Davines Davines Love Mask Rizo 250Ml 250 ml,"23,70 €"
2023-03-30 16:08:34,,,
2023-03-30 16:08:34,,,
2023-03-30 16:08:34,,,
2023-03-30 16:08:39,,,
2023-03-30 16:08:39,https://m.media-amazon.com/images/I/617hFXLgy1L._AC_UY218_.jpg,Davines Essential Melu Shampoo 250 ml,"17,90 €"
2023-03-30 16:08:39,https://m.media-amazon.com/images/I/7101O1RUYlL._AC_UY218_.jpg,Davines Essential Champú Dede 295000 g,"17,40 €"
2023-03-30 16:08:39,https://m.media-amazon.com/images/I/618XsBsIeZL._AC_UY218_.jpg,Davines Essential Acondicionador Nounou 250 Ml - 250 ml,"23,82 €"
2023-03-30 16:08:39,https://m.media-amazon.com/images/I/71ONvn43fDL._AC_UY218_.jpg,Davines Naturaltech Replumping Acondicionador 150 ml,"19,50 €"
2023-03-30 16:08:39,https://m.media-amazon.com/images/I/81u0DiMx2WL._AC_UY218_.jpg,Davines Naturaltech Well-Being Shampoo 250ml,"19,89 €"
2023-03-30 16:08:39,https://m.media-amazon.com/images/I/81OOWiPkwGL._AC_UY218_.jpg,Davines Naturaltech Detoxifying Scrub Champú 250 ml,"19,89 €"
2023-03-30 16:08:39,https://m.media-amazon.com/images/I/617LFfN0y2L._AC_UY218_.jpg,Davines Essential Solu Champú 400 g (881-14861),"18,89 €"
2023-03-30 16:08:39,https://m.media-amazon.com/images/I/41FPLmCU8oL._AC_UY218_.jpg,Davines More Inside – Strong Moulding Clay,"22,90 €"
2023-03-30 16:08:39,https://m.media-amazon.com/images/I/61frKUCrCDL._AC_UY218_.jpg,Davines Heart Of Glass Rich Acondicionador 250 Ml,"28,74 €"
2023-03-30 16:08:39,https://m.media-amazon.com/images/I/718f-kCb10L._AC_UY218_.jpg,Davines More Inside Medium Hold Finishing Gum - 75 ml,"23,11 €"
2023-03-30 16:08:39,https://m.media-amazon.com/images/I/61BE+HkCXLL._AC_UY218_.jpg,Davines Heart Of Glass Sheer Glaze 150 Ml,"23,40 €"
2023-03-30 16:08:39,https://m.media-amazon.com/images/I/41dMkLTx-xL._AC_UY218_.jpg,Davines Essential Melu Conditioner 250 Ml - 250 ml,"21,79 €"
2023-03-30 16:08:39,https://m.media-amazon.com/images/I/61aNnP2A17L._AC_UY218_.jpg,Davines Dede Conditioner 250ml,"20,42 €"
2023-03-30 16:08:39,https://m.media-amazon.com/images/I/71kvCz8u76L._AC_UY218_.jpg,Davines More Inside Medium Hold Pliable Paste - 125 ml,"25,20 €"
2023-03-30 16:08:39,https://m.media-amazon.com/images/I/81tEdZR1bIL._AC_UY218_.jpg,Davines More inside Shine wax 75ml (13509),"21,90 €"
2023-03-30 16:08:39,https://m.media-amazon.com/images/I/717j3O4NbpL._AC_UY218_.jpg,"Davines We Stand for Regeneration - Lavado para el cabello y el cuerpo de edición limitada, 8.45 onzas líquidas","18,40 €"
2023-03-30 16:08:39,,,
2023-03-30 16:08:39,,,
2023-03-30 16:08:39,,,
