fecha,imagen,nombre,distribuidor,precio,ASIN,EAN
18-04-2023,https://m.media-amazon.com/images/I/8171xcBNwDL._AC_SY879_.jpg,davines more inside curl building serum - 250 ml,P&CProfesional,21.15,B00GCCQ3DI,
18-04-2023,https://m.media-amazon.com/images/I/51B+6TcPl0L._AC_SX522_.jpg,davines nourishing naturaltech shampoo 250 ml,P&CProfesional,20.25,B07XT173PR,
18-04-2023,https://m.media-amazon.com/images/I/71ONvn43fDL._SY679_.jpg,davines naturaltech replumping acondicionador 150 ml,P&CProfesional,19.13,B00GTW4QQ2,
18-04-2023,https://m.media-amazon.com/images/I/61VFtW881fL._SY679_.jpg,"davines momo - champú, 250 ml (881-42109)",P&CProfesional,18.0,B001ARP2LY,
18-04-2023,https://m.media-amazon.com/images/I/61efmekJOJL._AC_SY879_.jpg,davines natural tech purifying shampoo (for scalp with oily or dry dan.,P&CProfesional,20.25,B0073FO9AM,
18-04-2023,https://m.media-amazon.com/images/I/71eQCAdLgUL._AC_SY879_.jpg,davines oi oil absolute beautifying potion 135 ml,P&CProfesional,38.68,B006TH5DUK,
18-04-2023,https://m.media-amazon.com/images/I/71VKDzk0r1L._AC_SX522_.jpg,davines essential haircare oi/shampoo - absolute beautifying shampoo.,P&CProfesional,53.55,B00HUEGDZU,8004608240730
18-04-2023,https://m.media-amazon.com/images/I/51tqI4Llw6L._AC_SY741_.jpg,"davines minu - champú, 250 ml",P&CProfesional,18.0,B00OKME7S0,
18-04-2023,https://m.media-amazon.com/images/I/81Oaf-dCApL._AC_SY879_.jpg,"davines natural tech energizing – champú para cabellos finos, fragiles y con tendencia a la caída",P&CProfesional,20.25,B006JYMPUO,
18-04-2023,https://m.media-amazon.com/images/I/61POgcMSYiL._AC_SY879_.jpg,"davines - leche protectora solar para el cabello su hair milk, 135 ml",P&CProfesional,26.99,B07BNRR82Z,
18-04-2023,https://m.media-amazon.com/images/I/716gvvoUnwL._AC_SY879_.jpg,davines more inside relaxing moisturizing fluid crema - 125 ml,P&CProfesional,19.13,B00GB8V338,8004608237495
18-04-2023,https://m.media-amazon.com/images/I/61LnDOXZX8L._SX522_.jpg,davines tcc the quick fix circle 50 ml.,P&CProfesional,11.0,B07661NQDH,8004608258216
18-04-2023,https://m.media-amazon.com/images/I/41xzRw9UBYL._AC_SX522_.jpg,davines essential haircare love curl revitalizer 75ml,P&CProfesional,11.25,B073WF21FL,8004608257943
18-04-2023,https://m.media-amazon.com/images/I/61L3TxAWYWL._AC_SX522_.jpg,davines naturaltech calming shampoo 250ml,P&CProfesional,20.25,B074HB44JQ,
18-04-2023,https://m.media-amazon.com/images/I/61GqXtIRJsL._SX522_.jpg,"davines - spray sin gas para fijación de pelo, 250 ml",P&CProfesional,21.04,B06XKKXX4D,8004608252146
18-04-2023,https://m.media-amazon.com/images/I/41dMkLTx-xL._AC_SX522_.jpg,davines essential melu conditioner 250 ml - 250 ml,P&CProfesional,20.03,SCLEROTIUM,
18-04-2023,https://m.media-amazon.com/images/I/51BUnKgpjuL._AC_SX522_.jpg,davines natural tech renewing shampoo (for all scalp and hair types) 1000ml,P&CProfesional,46.11,B07CWLKDQ9,
18-04-2023,https://m.media-amazon.com/images/I/51nObYh9SuL._AC_SX522_.jpg,davines davines ntech mini productos champãº purificante 100 ml 1 unidad 100 g,P&CProfesional,11.75,B00GHUZDFO,
18-04-2023,https://m.media-amazon.com/images/I/71eW1ni6gFL._SY679_.jpg,"davines volu hair mist - cuidado capilar, 250 ml",P&CProfesional,28.05,B00OOVQVGS,
18-04-2023,https://m.media-amazon.com/images/I/51lRZCTGsoL._AC_SX522_.jpg,"natural tech by davines - paquete nutritivo para el cabello, 250 ml",P&CProfesional,31.24,B07ZL56NS7,
18-04-2023,https://m.media-amazon.com/images/I/418h55GPzuL._SX522_.jpg,davines nounou shampoo 400 g,P&CProfesional,45.05,B009ES1PWG,
18-04-2023,https://m.media-amazon.com/images/I/610M7Uns1fL._SX522_.jpg,davines tcc the purity circle - 50 ml,P&CProfesional,11.0,B076QFV8CW,8004608258179
18-04-2023,https://m.media-amazon.com/images/I/419P6+8oKCL._SX522_.jpg,davines more inside volume boosting mousse 250ml.,P&CProfesional,21.25,B0162EDN4W,8004608247197
18-04-2023,https://m.media-amazon.com/images/I/91J036FcEYL._AC_SX522_.jpg,davines more inside forming pomade 75ml,P&CProfesional,23.38,B01H25XZKW,
18-04-2023,https://m.media-amazon.com/images/I/71hNMC0SwAL._SY679_.jpg,davines oi shampoo 90ml - champú multibenefit.,P&CProfesional,12.0,B01N2JKVVR,
18-04-2023,https://m.media-amazon.com/images/I/81E1Y8fq5DL._SY679_.jpg,davines aceite non oil - 250 ml,P&CProfesional,21.15,B00GCCH6AM,
18-04-2023,https://m.media-amazon.com/images/I/611XOl0YECL._AC_SY879_.jpg,davines essential haircare love curl hair mask 75ml - mascarilla pelo rizado,P&CProfesional,11.25,B078W83NXC,8004608257240
18-04-2023,https://m.media-amazon.com/images/I/71Tq+sCMsSL._SY679_.jpg,davines dede delicate acondicionador - 1000 ml,P&CProfesional,65.03,B00QFKRQO2,
18-04-2023,https://m.media-amazon.com/images/I/81XF-GgYhUL._AC_SY879_.jpg,davines more inside invisible serum efecto día despues - 50 ml,P&CProfesional,21.04,B00GB8RJ40,
18-04-2023,https://m.media-amazon.com/images/I/71csqe7W2FL._AC_SX522_.jpg,davines nourishing vegetarian miracle acondicionado 60 ml,P&CProfesional,11.75,B0725Q5H11,
18-04-2023,https://m.media-amazon.com/images/I/61Q5TMcwrLL._AC_SX522_.jpg,davines – dede delicate daily conditioner (for all hair types) 250 ml/8.45oz,P&CProfesional,20.03,B07CZ6DMK4,
18-04-2023,https://m.media-amazon.com/images/I/61CpcQhP9AL._AC_SY879_.jpg,"davines naturaltech calming superactive - cuidado capilar, 200 gr",P&CProfesional,40.16,DISILOXANE,
18-04-2023,https://m.media-amazon.com/images/I/61c-bl137FL._AC_SX522_.jpg,davines alchemic shampoo - # tobacco (for natural & coloured hair) 280ml,P&CProfesional,19.58,B0769VQS3T,
18-04-2023,https://m.media-amazon.com/images/I/3120NKAP5nL._AC_.jpg,natural tech rebalancing shampoo (for oily scalp) 1000ml/33.8oz,P&CProfesional,46.11,B00E5V7TO0,
18-04-2023,https://m.media-amazon.com/images/I/61IJn+JHioL._SX522_.jpg,davines naturaltech calming shampoo 1000 ml - 100 ml,P&CProfesional,46.11,B074SHC7XG,8004608256649
18-04-2023,https://m.media-amazon.com/images/I/61cEaO6s0mL._AC_SX522_.jpg,"daviness, cuidado del pelo y del cuero cabelludo - 75 gr.",P&CProfesional,12.0,B01M5JMMZA,
18-04-2023,https://m.media-amazon.com/images/I/61hMvpueUEL._AC_SY879_.jpg,davines aceite - 100 ml,P&CProfesional,29.95,B0073FZHMG,8004608230786
18-04-2023,https://m.media-amazon.com/images/I/71nUNV--jVL._AC_SY879_.jpg,davines essential haircare love curl cleansing cream - 500 ml,P&CProfesional,30.18,B073WXJKK8,
18-04-2023,https://m.media-amazon.com/images/I/81PEt-WpV9L._AC_SX522_.jpg,naturaltech natural tech mini productos champú replumping - 100 ml,P&CProfesional,11.75,B01F1XQ82Y,8004608245179
18-04-2023,https://m.media-amazon.com/images/I/51doV2V7d-L._AC_SX522_.jpg,davines minu champú illuminating protective champú (for coloured hair) 1000 ml/33.8oz,P&CProfesional,45.05,B07D1DJ8TH,
18-04-2023,https://m.media-amazon.com/images/I/6167vVyOkoL._SY679_.jpg,davines su champu para cabello&cuerpo 75 200 g,P&CProfesional,11.25,B00VO6BJ40,
18-04-2023,https://m.media-amazon.com/images/I/71WsWjqoRIL._AC_SY879_.jpg,davines su hair mask 150ml - mascarilla reparadora para después del sol,P&CProfesional,23.38,B07C92PVBJ,
18-04-2023,https://m.media-amazon.com/images/I/71YTZdSpIXL._AC_SX522_.jpg,davines energizing superactive hair serum 100ml,P&CProfesional,67.15,B09BK9SPL9,8004608275374
18-04-2023,https://m.media-amazon.com/images/I/31bN+JWylJL._AC_.jpg,natural tech replumping conditioner (for all hair types) 1000ml/33.8oz,P&CProfesional,56.1,B01CUYO004,
18-04-2023,https://m.media-amazon.com/images/I/510yPHWoVjL._SX522_.jpg,naturaltech natural tech mini productos champú energizante - 100 ml,P&CProfesional,11.75,B073P2JXJ6,8004608255499
18-04-2023,https://m.media-amazon.com/images/I/31WfmI0AeIL._AC_SX522_.jpg,"davines, set de regalo de pelo - 400 ml.",P&CProfesional,22.74,B01LY8TERO,8004608252122
18-04-2023,https://m.media-amazon.com/images/I/71Gd2tDswFL._AC_SY879_.jpg,davines minu illuminating mascarilla para el pelo - 1000 ml,P&CProfesional,73.53,B00QFL8G9U,8004608242642
18-04-2023,https://m.media-amazon.com/images/I/51y3GwSclOL._SX522_.jpg,davines finest pigments #5 castaño claro 280 ml - 280 ml,P&CProfesional,54.61,B008AW6L5S,
18-04-2023,https://m.media-amazon.com/images/I/51KyZiBokqL._AC_SX522_.jpg,davines finest pigments no8 light blonde 280 ml,P&CProfesional,54.61,B008AW7EHM,
18-04-2023,https://m.media-amazon.com/images/I/514cfbZ+dzL._AC_SX522_.jpg,davines alchemic system alchemic conditioner chocolate 250ml,P&CProfesional,25.93,B075PDDFKD,
18-04-2023,https://m.media-amazon.com/images/I/71fIZhi6eSL._AC_SY879_.jpg,davines natural tech well-being champú - 100 ml,P&CProfesional,11.75,B00CGPJDCS,8004608230731
18-04-2023,https://m.media-amazon.com/images/I/31YIgkiiFXL._AC_.jpg,davines – natural de tech well being conditioner 1000 ml/33.8oz,P&CProfesional,56.1,B07D1S8MV8,
18-04-2023,https://m.media-amazon.com/images/I/61orhAryb+L._SX522_.jpg,davines r renewing pro boost superactivo 500 ml.,P&CProfesional,65.9,B075JM91SV,
18-04-2023,https://m.media-amazon.com/images/I/51aLQiqyZ8L._AC_SY355_.jpg,davines finest pigments red 280ml,P&CProfesional,69.25,B00VDW61LQ,
18-04-2023,https://m.media-amazon.com/images/I/513nhkTMENL._AC_SX522_.jpg,davines nt detoxifying scrub champú 100 ml,P&CProfesional,11.75,B07DRJ7KSM,8004608256809
18-04-2023,https://m.media-amazon.com/images/I/61ty+VqVwoL._AC_SX522_.jpg,davines natural tech detoxifying scrub shampoo (for atonic scalp) 1000ml,P&CProfesional,46.11,B075QLWXGP,
18-04-2023,https://m.media-amazon.com/images/I/816IvMudwCL._AC_SY879_.jpg,"daviness, acondicionador de pelo - 125 gr.",P&CProfesional,19.13,B00GB8T5P6,8004608237471
18-04-2023,https://m.media-amazon.com/images/I/51q36-7PcdL._SX522_.jpg,"daviness - tinte con extractos de plantas, 280 ml, mahogany/mogano",P&CProfesional,54.61,B0087CW9G6,8004608224068
18-04-2023,https://m.media-amazon.com/images/I/61BllWB2D1L._SY679_.jpg,"daviness, filtro solar corporal - 150 gr.",P&CProfesional,22.31,B00OOU62GI,8004608242437
18-04-2023,https://m.media-amazon.com/images/I/61MzbwEZ3QL._AC_SX522_.jpg,momo hair potion moisturizing universal cream (for dry or dehydrated hair) 150ml/5.07oz,P&CProfesional,22.74,B0774H86RS,
18-04-2023,https://m.media-amazon.com/images/I/51KSK4kmLaL._AC_SX522_.jpg,"daviness, cuidado del pelo y del cuero cabelludo - 280 gr.",P&CProfesional,54.61,B007804K1U,8004608224105
18-04-2023,https://m.media-amazon.com/images/I/51MIzKODCxL._AC_SX522_.jpg,active pureness mask,P&CProfesional,36.9,B01N36O3RT,
18-04-2023,https://m.media-amazon.com/images/I/51Gz-mrycVL._AC_SX522_.jpg,body strategist leg gel 200 ml,P&CProfesional,52.2,B085GK4LQF,
18-04-2023,https://m.media-amazon.com/images/I/51rwUTrMUfL._AC_SX522_.jpg,"comfort zone aromasoul - crema corporal mediterránea, 200 ml",P&CProfesional,40.5,B07KJ8MPD1,
18-04-2023,https://m.media-amazon.com/images/I/61U0onW5VjL._AC_SX522_.jpg,skin regimen microalgae essence 100 ml,P&CProfesional,62.1,B07C7KCF4W,
18-04-2023,https://m.media-amazon.com/images/I/515DV73WGiL._AC_SX522_.jpg,comfort zone hydramemory serum 30 ml,P&CProfesional,66.6,B07L5Q9F49,
18-04-2023,https://m.media-amazon.com/images/I/716G9PJu7TL._SX522_.jpg,"redken | champú hidratante con aceite de argán para cabello seco y frágil, all soft, 300 ml",P&CProfesional,21.95,B08Y1CYNF3,
18-04-2023,https://m.media-amazon.com/images/I/51Gp8+4gblL._AC_SY879_.jpg,fanola nourishing shampoo 1000 ml,P&CProfesional,15.05,B08HM4LQJD,
18-04-2023,https://m.media-amazon.com/images/I/51W+bNuc8QL._AC_SX522_.jpg,"comfort zone, crema y leche facial - 50 ml.",P&CProfesional,102.6,B07BZDZ3JM,
18-04-2023,https://m.media-amazon.com/images/I/814GZG+9RsL._AC_SY879_.jpg,comfort zone sublime skin mascarilla de ojos - 6 unidades,P&CProfesional,69.3,B015UDH09A,
18-04-2023,https://m.media-amazon.com/images/I/61xOBfuguiL._AC_SX522_.jpg,comfort zone sublime skin crema - 60 ml,P&CProfesional,120.6,B015UCTS5U,
18-04-2023,https://m.media-amazon.com/images/I/41Maogp9dIL._AC_SX522_.jpg,comfort zone sublime skin suero - 30 ml,P&CProfesional,110.7,B015UD5JLG,
18-04-2023,https://m.media-amazon.com/images/I/41cZuhuKwdL._AC_SY741_.jpg,comfort zone - active pureness corrector,P&CProfesional,35.1,B01N9UH4T9,
18-04-2023,https://m.media-amazon.com/images/I/61hRywrsm4L._SX522_.jpg,"redken | champú sin sulfatos para fortalecer todo tipo de cabellos, acidic bonding concentrate, 300 ml",P&CProfesional,27.95,B08P66Q9TK,
18-04-2023,https://m.media-amazon.com/images/I/51azBivbFaL._AC_SX522_.jpg,comfort zone renight crema - 60 ml,P&CProfesional,77.4,B01DRZEK96,
18-04-2023,https://m.media-amazon.com/images/I/71RjVAaX4BL._SX522_.jpg,"redken | mascarilla reparadora con proteínas para cabello dañado, extreme strength builder plus, formato 250 ml",P&CProfesional,28.53,B08Y178YMS,
18-04-2023,https://m.media-amazon.com/images/I/616H20SWczL._AC_SY879_.jpg,"fanola, cuidado del pelo y del cuero cabelludo - 1 unidad",P&CProfesional,18.0,B00CGPLQY6,8032947862382
18-04-2023,https://m.media-amazon.com/images/I/51ifGXPPENL._AC_SX522_.jpg,comfort zone sublime skin crema de ojos - 15 ml,P&CProfesional,69.3,B015UD2POA,
18-04-2023,https://m.media-amazon.com/images/I/51X6cfkyJEL._SX522_.jpg,comfort zone renight mask -60 ml,P&CProfesional,65.7,B07Z1BWSYX,
18-04-2023,https://m.media-amazon.com/images/I/71p3-v8CIML._SX522_.jpg,"redken | champú densificador para caballo con falta de volumen, volume injection, 300 ml",P&CProfesional,23.8,B08Y155F2X,
18-04-2023,https://m.media-amazon.com/images/I/714cIe3ZkmL._SX522_.jpg,redken acondicionador high rise volume para cabello con falta de volumen,P&CProfesional,26.75,B08Y1DT652,
18-04-2023,https://m.media-amazon.com/images/I/51ZAwrDvBcL._AC_SX522_.jpg,comfort zone hydramemory cream gel tratamiento facial - 60 ml,P&CProfesional,73.8,B075WD97B2,
18-04-2023,https://m.media-amazon.com/images/I/513GgFTdo6L._AC_SX522_.jpg,"comfort zone, crema corporal - 200 ml.",P&CProfesional,68.4,B07C25PY16,
18-04-2023,https://m.media-amazon.com/images/I/51wt5HHZ1KL._AC_SX522_.jpg,comfort zone hydramemory eye gel contorno de ojos - 15 ml,P&CProfesional,35.1,B06Y3NHWVG,
18-04-2023,https://m.media-amazon.com/images/I/61c-3ObX4NL._AC_SY450_.jpg,curly shine,P&CProfesional,19.8,B01E06NVEG,8032947868780
18-04-2023,https://m.media-amazon.com/images/I/51ksrLHmZZL._AC_SX522_.jpg,comfort zone tranquillity body crema - 180 ml,P&CProfesional,83.7,B01NB0TI00,
18-04-2023,https://m.media-amazon.com/images/I/516eBH72roL._AC_SX522_.jpg,comfort zone essential care limpiador facial - 150 ml,P&CProfesional,29.7,B01MSA66C8,
18-04-2023,https://m.media-amazon.com/images/I/51JvWW-iM7L._AC_SY355_.jpg,body strategist cream 200 ml,P&CProfesional,69.3,STRATEGIST,
18-04-2023,https://m.media-amazon.com/images/I/61ej3c1FxkL._SX522_.jpg,"redken | champú protector del color para cabellos coloreados, color extend magnetics, 300ml",P&CProfesional,19.9,B08Y1F7G31,
18-04-2023,https://m.media-amazon.com/images/I/51679iAdIML._AC_SX522_.jpg,comfort zone remedy cream to oil limpiador facial - 150 ml,P&CProfesional,43.2,B06XDGM9HL,
18-04-2023,https://m.media-amazon.com/images/I/51jx16ylApL._AC_SX522_.jpg,"comfort zone, crema y leche facial - 25 ml.",P&CProfesional,93.6,B07BZM3HQH,
18-04-2023,https://m.media-amazon.com/images/I/41AScW6egkL._AC_SX522_.jpg,comfort zone essential care toner limpiador - 200 ml,P&CProfesional,30.6,B01NAVYVLG,
18-04-2023,https://m.media-amazon.com/images/I/51oBj+HcUTL._SX522_.jpg,comfort zone tranquillity body loción - 200 ml,P&CProfesional,52.2,B01MUI8JBV,
18-04-2023,https://m.media-amazon.com/images/I/6168kWFcNHL._AC_SX522_.jpg,comfort zone sublime skin rich cream tratamiento facial - 60 ml,P&CProfesional,120.88,B0190MZQ34,
18-04-2023,https://m.media-amazon.com/images/I/41OZ-bjYmRL._AC_SX522_.jpg,comfort zone tranquillity blend tratamiento corporal - 50 ml,P&CProfesional,81.9,B01MYFU663,
18-04-2023,https://m.media-amazon.com/images/I/51RHsfqdghL._AC_SX522_.jpg,comfort zone tranquillity shower crema - 200 ml,P&CProfesional,34.2,B01ND3RNF9,
18-04-2023,https://m.media-amazon.com/images/I/51oFEdlTfsL._AC_SY879_.jpg,comfort zone sublime skin essence 100 ml,P&CProfesional,68.4,B077NF3R4W,
18-04-2023,https://m.media-amazon.com/images/I/51xHNBQN72L._AC_SX522_.jpg,comfort zone tranquillity bath & body oil aceite - 200 ml,P&CProfesional,89.1,B01NC23R9N,
18-04-2023,https://m.media-amazon.com/images/I/416Em1V9wyL._AC_SX522_.jpg,comfort zone remedy cream tratamiento facial - 60 ml,P&CProfesional,63.9,B06XDGDTM9,
18-04-2023,https://m.media-amazon.com/images/I/51uRMZqMBTL._AC_SX522_.jpg,"comfort zone, loción corporal - 200 ml.",P&CProfesional,36.0,B01N7UYUVY,8004698179668
18-04-2023,https://m.media-amazon.com/images/I/41q+WaYgwoL._AC_SX522_.jpg,comfort zone - active pureness hydra fluid,P&CProfesional,45.9,B01NBXIKIL,
18-04-2023,https://m.media-amazon.com/images/I/41pqH05J8EL._AC_SX522_.jpg,comfort zone sun soul oil spf 6 aceite corporal - 150 ml,P&CProfesional,39.0,B074Y3DQ47,
18-04-2023,https://m.media-amazon.com/images/I/511NxeoqgEL._AC_SX522_.jpg,sublime skin mascarilla elevadora.,P&CProfesional,86.4,B077NGWYRX,
18-04-2023,https://m.media-amazon.com/images/I/51bT2OlSYVL._SX522_.jpg,comfort zone hydramemory cream tratamiento facial - 60 ml,P&CProfesional,73.8,B01JTHDLTQ,
18-04-2023,https://m.media-amazon.com/images/I/51gb1tEOR4L._AC_SX522_.jpg,comfort zone remedy defense crema - 60 ml,P&CProfesional,76.5,B06XD65SNZ,
18-04-2023,https://m.media-amazon.com/images/I/51fwmbHdc+L._AC_SX522_.jpg,comfort zone active pureness gel,P&CProfesional,39.6,B01N5S2BHO,
18-04-2023,https://m.media-amazon.com/images/I/51sawcKkxUL._SX522_.jpg,"daviness, cuidado del pelo y del cuero cabelludo - 280 gr.",P&CProfesional,54.61,B00514HDDW,8004608224037
18-04-2023,https://m.media-amazon.com/images/I/51ZE-E-JBGL._AC_SX522_.jpg,comfort zone essential - desmaquillador bifásico,P&CProfesional,32.4,B07KJBL9RK,
18-04-2023,https://m.media-amazon.com/images/I/51f9jNpX4cL._AC_SX522_.jpg,comfort zone aromasoul - gel de ducha (200 ml),P&CProfesional,25.2,B07KK15DY1,
18-04-2023,https://m.media-amazon.com/images/I/618Ipo+1LVL._AC_SY741_.jpg,su crema protectora spf30 cara y cuerpo 100 ml,P&CProfesional,31.25,B08BV2JHQ5,
18-04-2023,https://m.media-amazon.com/images/I/61DipDlPqRL._AC_SY879_.jpg,"daviness, acondicionador de pelo - 75 gr.",P&CProfesional,11.25,B00VO6BMSS,8004608242987
18-04-2023,https://m.media-amazon.com/images/I/71ki0BqAwzL._SX385_.jpg,comfort zone sublime - crema de aceite para la piel (1 unidad),P&CProfesional,123.3,B07KJB395Z,
18-04-2023,https://m.media-amazon.com/images/I/51ImE7oSpLL._SY679_.jpg,suero sublime skin oil de comfort zone.,P&CProfesional,110.7,B07KJD3N8M,
18-04-2023,https://m.media-amazon.com/images/I/61Sk9fwSlGL._AC_SY879_.jpg,"daviness, acondicionador de pelo - 75 gr.",P&CProfesional,11.25,B00VO6BQ98,8004608242963
18-04-2023,https://m.media-amazon.com/images/I/71VDd-2i5+L._SX522_.jpg,"daviness, filtro solar corporal - 280 gr.",P&CProfesional,18.0,B00WT4CKH6,8004608247760
18-04-2023,https://m.media-amazon.com/images/I/61BqJCWy4bL._SX522_.jpg,skeyndor essential mini productos acondicionador minu - 75 ml,P&CProfesional,11.25,B00R13JF82,8004608253396
18-04-2023,https://m.media-amazon.com/images/I/51z18aFaY+L._AC_SX522_.jpg,"daviness, cuidado del pelo y del cuero cabelludo - 60 ml",P&CProfesional,11.75,B00VO6CERG,8004608245186
18-04-2023,https://m.media-amazon.com/images/I/51Zyvoq3avL._AC_SX522_.jpg,"comfort zone agua micelar esencial – botella de 200 ml – elimina el maquillaje fácilmente – para cara, ojos, labios – limpia poros, refrescante, ingredientes naturales",P&CProfesional,31.5,B01N36NQVJ,
18-04-2023,https://m.media-amazon.com/images/I/51ipoyaJgXL._AC_SX522_.jpg,authentic fórmulas nourishing oil r&c&c 140 ml,P&CProfesional,35.49,B01LEJKG36,
18-04-2023,https://m.media-amazon.com/images/I/81gMerN1KVL._AC_SY879_.jpg,davines concentrado - 500 ml,P&CProfesional,17.0,B0073G6B70,8004608230854
18-04-2023,https://m.media-amazon.com/images/I/51x6enww6+L._AC_SX522_.jpg,davines fitnest pigments nº4 medium brown/castaño,P&CProfesional,69.25,B005CKGO7Q,
18-04-2023,https://m.media-amazon.com/images/I/51D06qlltsL._AC_SY355_.jpg,davines fitnest pigments nº7 blonde/rubio medio,P&CProfesional,69.25,B0087CWAJC,
18-04-2023,https://m.media-amazon.com/images/I/61y1tu57KmL._AC_SX522_.jpg,davines elevating clay supercleanser 120g,P&CProfesional,95.84,B09LM698WG,
18-04-2023,https://m.media-amazon.com/images/I/41s4R5HomqL._AC_SX522_.jpg,"davines, set de regalo de pelo - 100 ml.",P&CProfesional,11.25,B01DF7WCP0,8004608250623
18-04-2023,https://m.media-amazon.com/images/I/71eITCwjI4L._AC_SY879_.jpg,"davines sobre aftersun aftersun para el rostro y el cuerpo, novedad 2018, 150 ml",P&CProfesional,29.75,B07C54JJRX,
18-04-2023,https://m.media-amazon.com/images/I/71PCmPX0+RL._AC_SX522_.jpg,davines nt nourishing hair building pak 60 ml*,P&CProfesional,11.75,B07D8RKS7Y,
18-04-2023,https://m.media-amazon.com/images/I/71pBlYxU7sL._AC_SY879_.jpg,"daviness, filtro solar corporal - 75 gr.",P&CProfesional,20.19,B015JWDUUA,8004608247746
18-04-2023,https://m.media-amazon.com/images/I/61Cx88pHWBL._AC_SX522_.jpg,davines nounou nourishing mascarilla para el pelo - 1000 ml,P&CProfesional,73.53,B0165H0MRC,8004608242086
18-04-2023,https://m.media-amazon.com/images/I/41utixM+ylL._AC_SX522_.jpg,davines more inside shimmering mist - 200 ml,P&CProfesional,20.19,B0746GSVF6,8004608252153
18-04-2023,https://m.media-amazon.com/images/I/71Kyra1kUGL._AC_SX522_.jpg,davines naturaltech tratamiento anticaida cabello 6 ml,P&CProfesional,70.55,B075JMLSGX,8004608255543
18-04-2023,https://m.media-amazon.com/images/I/51OH8c00iYL._AC_SY355_.jpg,davines fitnest pigments pearl/perla 280ml,P&CProfesional,54.61,B005CKGPKW,
18-04-2023,https://m.media-amazon.com/images/I/51j0HnVR80L._SY679_.jpg,davines finest pigments #6 rubio oscuro 280 ml - 280 ml,P&CProfesional,69.25,B07DX32TLC,
18-04-2023,https://m.media-amazon.com/images/I/610SWVY-RKL._AC_SY879_.jpg,davines solu shampoo - 75 ml,P&CProfesional,11.25,B00WQ60EKC,8004608243007
18-04-2023,https://m.media-amazon.com/images/I/511SxrWYoUL._AC_SX522_.jpg,davines naturaltech calming shampoo 100ml - champú lenitivo,P&CProfesional,11.75,B075JLRNG8,
18-04-2023,https://m.media-amazon.com/images/I/513Nvq4WlCL._AC_SY355_.jpg,davines fitnest pigments nº9 very light blonde/rubioclarisimo 280ml,P&CProfesional,54.61,B005CKGPE8,
18-04-2023,https://m.media-amazon.com/images/I/71qcxoevlCL._AC_SX522_.jpg,davines – natural tech renewing conditioning treatment (for all scalp and hair types) 1000 ml/33.81oz,P&CProfesional,74.8,B07D1ST87V,
18-04-2023,https://m.media-amazon.com/images/I/81DrUs2nO4L._AC_SY879_.jpg,davines natural tech well-being acondicionador - 60 ml,P&CProfesional,11.75,B00CGPMFA0,8004608234944
18-04-2023,https://m.media-amazon.com/images/I/81EaAI0mfEL._AC_SY879_.jpg,"daviness, cuidado del pelo y del cuero cabelludo - 100 gr.",P&CProfesional,11.75,B00CGPKMVY,8004608230526
18-04-2023,https://m.media-amazon.com/images/I/51BuSNfxQKL._AC_SX522_.jpg,davines authentic formulas authentic moisturising balm 150ml,P&CProfesional,20.19,B00F6BYYTQ,
18-04-2023,https://m.media-amazon.com/images/I/61ISrWHGkwL._AC_SY879_.jpg,"daviness, acondicionador de pelo - 75 gr.",P&CProfesional,11.25,B00VO6BSRS,8004608243038
18-04-2023,https://m.media-amazon.com/images/I/71xHsEc-wcL._AC_SY879_.jpg,davines naturaltech renewing serum superactive 100ml.,P&CProfesional,54.0,B06XSHRGT7,
18-04-2023,https://m.media-amazon.com/images/I/51LQ4kNa7sL._SY679_.jpg,davines davines finest pigments copper 280ml 280 ml,P&CProfesional,54.61,B0087CW9NO,8004608224051
18-04-2023,https://m.media-amazon.com/images/I/51D9EEDgdFL._SX522_.jpg,davines alchemic silver conditioner 1000ml,P&CProfesional,68.85,B0784D66QS,
18-04-2023,https://m.media-amazon.com/images/I/519FuKYtiCL._AC_SX522_.jpg,davines finest pigments sand - sabbia 280ml,P&CProfesional,54.61,B0087CWA24,
18-04-2023,https://m.media-amazon.com/images/I/71DfSVDg7GL._SX522_.jpg,"melu, maquillaje corrector - 75 gr.",P&CProfesional,11.25,B00WQ5XDV0,8004608256434
18-04-2023,https://m.media-amazon.com/images/I/719EBbT0MRL._SX522_.jpg,"daviness, filtro solar corporal - 75 gr.",P&CProfesional,11.25,B00VO6BX6E,
18-04-2023,https://m.media-amazon.com/images/I/511e0QXqKXL._SX522_.jpg,davines love curl revitalizer - 250 ml,P&CProfesional,29.75,B073SX8CPX,8004608257196
18-04-2023,https://m.media-amazon.com/images/I/71GPLCmwAnL._AC_SX522_.jpg,davines naturaltech rebalance shampoo 100ml 100 ml,P&CProfesional,11.75,B071NJW7MM,8004608256816
18-04-2023,https://m.media-amazon.com/images/I/71PNOSvlBFL._SY679_.jpg,davines naturaltech well being acondicionador 150 ml,P&CProfesional,19.13,B0073FWI0K,
18-04-2023,https://m.media-amazon.com/images/I/51xLgXEdmgS._AC_SX522_.jpg,davines nourishing vegetarian miracle acondicionador 1000 ml,P&CProfesional,71.61,NOURISHING,
18-04-2023,https://m.media-amazon.com/images/I/71zovTICuvL._SY679_.jpg,momo shampoo 1000 52000 g,P&CProfesional,45.05,B0165GZ7XC,
18-04-2023,https://m.media-amazon.com/images/I/71dX3P3mneL._AC_SX522_.jpg,"daviness, acondicionador de pelo - 75 gr.",P&CProfesional,11.25,B015UMASM2,
18-04-2023,https://m.media-amazon.com/images/I/61tsFM2rmPL._SY679_.jpg,"daviness, cuidado del pelo y del cuero cabelludo - 250 ml",P&CProfesional,21.25,B0130KXHW4,8004608247203
18-04-2023,https://m.media-amazon.com/images/I/61Zh5uK6QNL._SY679_.jpg,davines nounou acondicionador 75 ml.,P&CProfesional,11.25,B00VO6BYRM,
18-04-2023,https://m.media-amazon.com/images/I/31pHOvXV4sL._AC_.jpg,davines essential haircare nounou conditioner 1000ml/33.8oz (salon size) by davines,P&CProfesional,65.03,B00R1BY86I,
18-04-2023,https://m.media-amazon.com/images/I/61hJhHUTnrL._AC_SY879_.jpg,davines pasta&love pre shaving & beard oil 50ml,P&CProfesional,22.74,B08KV56N1K,
18-04-2023,https://m.media-amazon.com/images/I/81tEdZR1bIL._AC_SX522_.jpg,davines more inside shine wax 75ml (13509),P&CProfesional,22.31,DICAPRYLYL,
