fecha,imagen,nombre,distribuidor,precio
30-03-2023,https://m.media-amazon.com/images/I/61R0Gfz7SoL._AC_UY218_.jpg,davines champú love smoothing - 250 ml,GoodCareCosmetics,"19,90 €"
30-03-2023,https://m.media-amazon.com/images/I/71IXlMO4HRL._AC_UY218_.jpg,davines love smooth mask 250ml disciplinante nuevo formato,GoodCareCosmetics,"25,90 €"
30-03-2023,https://m.media-amazon.com/images/I/61VFtW881fL._AC_UY218_.jpg,"davines momo - champú, 250 ml (881-42109)",GoodCareCosmetics,"20,23 €"
30-03-2023,https://m.media-amazon.com/images/I/51tqI4Llw6L._AC_UY218_.jpg,"davines minu - champú, 250 ml",GoodCareCosmetics,"19,90 €"
30-03-2023,https://m.media-amazon.com/images/I/614obxZHuqL._AC_UY218_.jpg,"davines love curl controller - crema para cabello, 150 ml",GoodCareCosmetics,"25,30 €"
30-03-2023,https://m.media-amazon.com/images/I/81rPSzWE1YL._AC_UY218_.jpg,davines naturaltech renewing shampoo 250ml - champù de longevidad todo.,GoodCareCosmetics,"19,91 €"
30-03-2023,https://m.media-amazon.com/images/I/615TtgIbd1L._AC_UY218_.jpg,davines momo moisturizing conditioner (for dry or dehydrated hair) 250.,GoodCareCosmetics,"22,55 €"
30-03-2023,https://m.media-amazon.com/images/I/617hFXLgy1L._AC_UY218_.jpg,davines essential melu shampoo 250 ml,GoodCareCosmetics,"21,90 €"
30-03-2023,https://m.media-amazon.com/images/I/61PkAII-MvL._AC_UY218_.jpg,davines davines love mask rizo 250ml 250 ml,GoodCareCosmetics,"29,90 €"
30-03-2023,https://m.media-amazon.com/images/I/61efmekJOJL._AC_UY218_.jpg,davines natural tech purifying shampoo (for scalp with oily or dry dan.,GoodCareCosmetics,"22,50 €"
30-03-2023,https://m.media-amazon.com/images/I/7101O1RUYlL._AC_UY218_.jpg,davines essential champú dede 295000 g,GoodCareCosmetics,"20,27 €"
30-03-2023,https://m.media-amazon.com/images/I/51BUnKgpjuL._AC_UY218_.jpg,davines natural tech renewing shampoo (for all scalp and hair types) 1000ml,GoodCareCosmetics,"65,81 €"
30-03-2023,https://m.media-amazon.com/images/I/617LFfN0y2L._AC_UY218_.jpg,davines essential solu champú 400 g (881-14861),GoodCareCosmetics,"20,90 €"
30-03-2023,https://m.media-amazon.com/images/I/71DJ2jgV7XL._AC_UY218_.jpg,davines more inside texturizing dust 8gr (12085),GoodCareCosmetics,"26,56 €"
30-03-2023,https://m.media-amazon.com/images/I/61lKj2+OR5L._AC_UY218_.jpg,davines alchemic conditioner - # tobacco (for natural & coloured hair) 250ml,GoodCareCosmetics,"28,91 €"
30-03-2023,https://m.media-amazon.com/images/I/413LeWVOkHL._AC_UY218_.jpg,"davines 75098-d melu champú, 1000 ml",GoodCareCosmetics,"67,90 €"
30-03-2023,https://m.media-amazon.com/images/I/61-M4CL5CLL._AC_UY218_.jpg,"davines love curl crème - cuidado capilar, 150 ml",GoodCareCosmetics,"23,50 €"
30-03-2023,https://m.media-amazon.com/images/I/610M7Uns1fL._AC_UY218_.jpg,davines tcc the purity circle - 50 ml,GoodCareCosmetics,"8,69 €"
30-03-2023,https://m.media-amazon.com/images/I/91J036FcEYL._AC_UY218_.jpg,davines more inside forming pomade 75ml,GoodCareCosmetics,"23,90 €"
30-03-2023,https://m.media-amazon.com/images/I/61c-bl137FL._AC_UY218_.jpg,davines alchemic shampoo - # tobacco (for natural & coloured hair) 280ml,GoodCareCosmetics,"20,50 €"
30-03-2023,https://m.media-amazon.com/images/I/71kTypzJCUL._AC_UY218_.jpg,"davines dededede barra de champú, 3.53 oz",GoodCareCosmetics,"19,90 €"
30-03-2023,https://m.media-amazon.com/images/I/716gvvoUnwL._AC_UY218_.jpg,davines more inside relaxing moisturizing fluid crema - 125 ml,GoodCareCosmetics,"19,51 €"
30-03-2023,https://m.media-amazon.com/images/I/81JMS-Sm-yL._AC_UY218_.jpg,davines alchemic silver champú 280 9460 g,GoodCareCosmetics,"20,50 €"
30-03-2023,https://m.media-amazon.com/images/I/81XF-GgYhUL._AC_UY218_.jpg,davines more inside invisible serum efecto día despues - 50 ml,GoodCareCosmetics,"19,00 €"
30-03-2023,https://m.media-amazon.com/images/I/61aNnP2A17L._AC_UY218_.jpg,davines dede conditioner 250ml,GoodCareCosmetics,"21,91 €"
30-03-2023,https://m.media-amazon.com/images/I/41yXNSoDQ4L._AC_UY218_.jpg,davines ntech champú regulador 154000 g,GoodCareCosmetics,"69,90 €"
30-03-2023,https://m.media-amazon.com/images/I/71BBkSF179L._AC_UY218_.jpg,davines serum para el cabello - 150 ml,GoodCareCosmetics,"22,90 €"
30-03-2023,https://m.media-amazon.com/images/I/71MGDlRpMEL._AC_UY218_.jpg,"davines love curl primer - leche nutritiva para cabello ondulado, 150 ml",GoodCareCosmetics,"28,90 €"
30-03-2023,https://m.media-amazon.com/images/I/71nUNV--jVL._AC_UY218_.jpg,davines essential haircare love curl cleansing cream - 500 ml,GoodCareCosmetics,"34,53 €"
30-03-2023,https://m.media-amazon.com/images/I/61BE+HkCXLL._AC_UY218_.jpg,davines heart of glass sheer glaze 150 ml,GoodCareCosmetics,"26,50 €"
30-03-2023,https://m.media-amazon.com/images/I/71KMSjgs8UL._AC_UY218_.jpg,davines essential hair care love curl conditioner 1000ml - acondicionador disciplinante,GoodCareCosmetics,"74,90 €"
30-03-2023,https://m.media-amazon.com/images/I/81tEdZR1bIL._AC_UY218_.jpg,davines more inside shine wax 75ml (13509),GoodCareCosmetics,"21,90 €"
30-03-2023,https://m.media-amazon.com/images/I/51uHTcy71AL._AC_UY218_.jpg,davines tcc the spotlight circle 750 ml.,GoodCareCosmetics,"79,90 €"
30-03-2023,https://m.media-amazon.com/images/I/61QaEP+5UtL._AC_UY218_.jpg,davines a single champu 250 ml.,GoodCareCosmetics,"25,50 €"
30-03-2023,https://m.media-amazon.com/images/I/814Az5MT9xL._AC_UY218_.jpg,davines naturaltech replumping hair filler superactivo 100 ml,GoodCareCosmetics,"33,19 €"
30-03-2023,https://m.media-amazon.com/images/I/71att2cfWIL._AC_UY218_.jpg,"davines ntech champú calmante 200 g, 250 ml",GoodCareCosmetics,"21,90 €"
30-03-2023,https://m.media-amazon.com/images/I/61vdz6GUP-L._AC_UY218_.jpg,davines alchemic red champú 280 287370 g,GoodCareCosmetics,"20,50 €"
30-03-2023,https://m.media-amazon.com/images/I/71cXb3CThyL._AC_UY218_.jpg,davines ntech champú replumping 1kg,GoodCareCosmetics,"74,90 €"
30-03-2023,https://m.media-amazon.com/images/I/61iFTUPDbAL._AC_UY218_.jpg,davines heart of glass intense treatment 750ml,GoodCareCosmetics,"75,66 €"
30-03-2023,https://m.media-amazon.com/images/I/61LHp8f1xwL._AC_UY218_.jpg,davines alchemic conditioner red (for natural & red or mahogany hair) 250ml,GoodCareCosmetics,"26,58 €"
30-03-2023,https://m.media-amazon.com/images/I/81FhyY6A6SL._AC_UY218_.jpg,davines more inside strong moulding clay cera - 75 ml,GoodCareCosmetics,"29,14 €"
30-03-2023,https://m.media-amazon.com/images/I/51KyZiBokqL._AC_UY218_.jpg,davines finest pigments no8 light blonde 280 ml,GoodCareCosmetics,"70,74 €"
30-03-2023,https://m.media-amazon.com/images/I/519FuKYtiCL._AC_UY218_.jpg,davines finest pigments sand - sabbia 280ml,GoodCareCosmetics,"59,90 €"
30-03-2023,https://m.media-amazon.com/images/I/51C7w02XHdL._AC_UY218_.jpg,davines the circle chronicles let it go circle 750ml - mascarilla relajante,GoodCareCosmetics,"69,90 €"
30-03-2023,https://m.media-amazon.com/images/I/61IJn+JHioL._AC_UY218_.jpg,davines naturaltech calming shampoo 1000 ml - 100 ml,GoodCareCosmetics,"64,90 €"
30-03-2023,https://m.media-amazon.com/images/I/41MnXkzjmIL._AC_UY218_.jpg,davines ntech champú well-being 200 g,GoodCareCosmetics,"23,48 €"
30-03-2023,https://m.media-amazon.com/images/I/71Tq+sCMsSL._AC_UY218_.jpg,davines dede delicate acondicionador - 1000 ml,GoodCareCosmetics,"68,50 €"
30-03-2023,https://m.media-amazon.com/images/I/71ZWRVyXxZL._AC_UY218_.jpg,davines alchemic coral creative conditioner 250ml,GoodCareCosmetics,"27,43 €"
30-03-2023,https://m.media-amazon.com/images/I/518uqFnQBBL._AC_UY218_.jpg,davines love smooth acondicionador 1000 ml,GoodCareCosmetics,"82,90 €"
30-03-2023,https://m.media-amazon.com/images/I/71pBlYxU7sL._AC_UY218_.jpg,"daviness, filtro solar corporal - 75 gr.",GoodCareCosmetics,"20,90 €"
30-03-2023,https://m.media-amazon.com/images/I/51KSK4kmLaL._AC_UY218_.jpg,"daviness, cuidado del pelo y del cuero cabelludo - 280 gr.",GoodCareCosmetics,"70,74 €"
30-03-2023,https://m.media-amazon.com/images/I/81gI5MxdyiL._AC_UY218_.jpg,davines alchemic system acondicionador chocolate - 250 ml,GoodCareCosmetics,"28,90 €"
30-03-2023,https://m.media-amazon.com/images/I/51j0HnVR80L._AC_UY218_.jpg,davines finest pigments #6 rubio oscuro 280 ml - 280 ml,GoodCareCosmetics,"69,90 €"
30-03-2023,https://m.media-amazon.com/images/I/71ZWNxNC+SL._AC_UY218_.jpg,davines alchemic marine blue creative conditioner 250ml,GoodCareCosmetics,"29,90 €"
30-03-2023,https://m.media-amazon.com/images/I/61OOjmUn-2L._AC_UY218_.jpg,davines alchemic shampoo - # chocolate (for natural & coloured hair) 280ml,GoodCareCosmetics,"23,90 €"
30-03-2023,https://m.media-amazon.com/images/I/71xHsEc-wcL._AC_UY218_.jpg,davines naturaltech renewing serum superactive 100ml.,GoodCareCosmetics,"59,90 €"
30-03-2023,https://m.media-amazon.com/images/I/81P1UqEcFnL._AC_UY218_.jpg,davines authentic fórmulas moisturizing balm r&c&c - 150 ml,GoodCareCosmetics,"23,88 €"
30-03-2023,https://m.media-amazon.com/images/I/61hJhHUTnrL._AC_UY218_.jpg,davines pasta&love pre shaving & beard oil 50ml,GoodCareCosmetics,"24,90 €"
30-03-2023,https://m.media-amazon.com/images/I/61ty+VqVwoL._AC_UY218_.jpg,davines natural tech detoxifying scrub shampoo (for atonic scalp) 1000ml,GoodCareCosmetics,"64,90 €"
30-03-2023,https://m.media-amazon.com/images/I/41NRP9orX6L._AC_UY218_.jpg,davines alchemic champú para natural y color,GoodCareCosmetics,"21,90 €"
30-03-2023,https://m.media-amazon.com/images/I/61NiiZlnaRL._AC_UY218_.jpg,davines melu mellow anti-breakage conditioner ecomille 265 g,GoodCareCosmetics,"71,87 €"
30-03-2023,https://m.media-amazon.com/images/I/41q2YzW5q2L._AC_UY218_.jpg,davines ntech champú well-being 2370 g,GoodCareCosmetics,"64,90 €"
30-03-2023,https://m.media-amazon.com/images/I/31WfmI0AeIL._AC_UY218_.jpg,"davines, set de regalo de pelo - 400 ml.",GoodCareCosmetics,"25,90 €"
30-03-2023,https://m.media-amazon.com/images/I/71eITCwjI4L._AC_UY218_.jpg,"davines sobre aftersun aftersun para el rostro y el cuerpo, novedad 2018, 150 ml",GoodCareCosmetics,"27,90 €"
30-03-2023,https://m.media-amazon.com/images/I/515UULu5HlL._AC_UY218_.jpg,davines elevating clay supercleanser 120g,GoodCareCosmetics,"89,90 €"
30-03-2023,https://m.media-amazon.com/images/I/71RleSXYHPL._AC_UY218_.jpg,davines alchemic teal blue creative conditioner 250ml,GoodCareCosmetics,"28,82 €"
30-03-2023,https://m.media-amazon.com/images/I/21N2uHhAfRL._AC_UY218_.jpg,davines - champú para reafirmar el volumen (for fine or limp hair) 1000 ml.,GoodCareCosmetics,"67,90 €"
30-03-2023,https://m.media-amazon.com/images/I/51xaCZHUTqL._AC_UY218_.jpg,davines – solu clarifying solution champú (for all hair types) 1000 ml/33.8oz,GoodCareCosmetics,"64,89 €"
30-03-2023,https://m.media-amazon.com/images/I/31GZ9KCZfJL._AC_UY218_.jpg,davines essential haircare nounou hair mask 1000ml/33.8oz (salon size) by davines,GoodCareCosmetics,"97,89 €"
30-03-2023,https://m.media-amazon.com/images/I/21AdhDxrSML._AC_UY218_.jpg,davines essential haircare minu hair mask 1000 ml/33.8oz (salon size) by davines,GoodCareCosmetics,"89,90 €"
30-03-2023,https://m.media-amazon.com/images/I/41+s4rjiHPL._AC_UY218_.jpg,davines the renaissance circle 6 x 50 ml,GoodCareCosmetics,"56,68 €"
30-03-2023,https://m.media-amazon.com/images/I/51q36-7PcdL._AC_UY218_.jpg,"daviness - tinte con extractos de plantas, 280 ml, mahogany/mogano",GoodCareCosmetics,"70,75 €"
30-03-2023,https://m.media-amazon.com/images/I/816IvMudwCL._AC_UY218_.jpg,"daviness, acondicionador de pelo - 125 gr.",GoodCareCosmetics,"20,90 €"
30-03-2023,https://m.media-amazon.com/images/I/61aNgUMI4zL._AC_UY218_.jpg,nutritivo champú 1000 ml,GoodCareCosmetics,"79,90 €"
30-03-2023,https://m.media-amazon.com/images/I/51sawcKkxUL._AC_UY218_.jpg,"daviness, cuidado del pelo y del cuero cabelludo - 280 gr.",GoodCareCosmetics,"59,90 €"
30-03-2023,https://m.media-amazon.com/images/I/61BllWB2D1L._AC_UY218_.jpg,"daviness, filtro solar corporal - 150 gr.",GoodCareCosmetics,"22,90 €"
30-03-2023,https://m.media-amazon.com/images/I/61LfaDIzYpL._AC_UY218_.jpg,malin + goetz vitamin b5 body lotion by (malin + goetz),GoodCareCosmetics,"37,90 €"
30-03-2023,https://m.media-amazon.com/images/I/71VDd-2i5+L._AC_UY218_.jpg,"daviness, filtro solar corporal - 280 gr.",GoodCareCosmetics,"20,00 €"
