nombre,precio
,
Davines More Inside Curl Building Serum - 250 ml,"23,50 €"
Davines Champú - 280 ml,"22,25 €"
Davines Oi Oil 50ml,"16,75 €"
Davines OI Absolute Beautifying Acondicionador - 250 ml,"26,75 €"
"Davines Natural Tech Energizing – Champú Para cabellos finos, fragiles y con tendencia a la caída","22,50 €"
Davines natural tech purifying shampoo (for scalp with oily or dry dan.,"22,50 €"
Davines Heart Of Glass Silkening Champu 250 Ml,"24,75 €"
Davines Champú Love Smoothing - 250 ml,"20,00 €"
Davines love lovely curl enchancing shampoo (for wavy or curly hair) 2.,"20,00 €"
Davines Naturaltech Replumping Champú 250 ml,"22,50 €"
Davines Naturaltech Replumping Acondicionador 150 ml,"21,25 €"
Davines Love smooth Mask 250ml disciplinante Nuevo Formato,"30,50 €"
"Davines nourishing vegetarian miracle conditioner""new 2019"" 250 ml","30,00 €"
"Davines Volu - Champú, 250 ml","20,00 €"
"Davines Momo - Champú, 250 ml (881-42109)","20,00 €"
"Davines Minu - Champú, 250 ml","20,00 €"
,
,
,
,
"Davines 69230 - Champú, 250 ml","22,50 €"
"Davines, Spray de Texturización en Seco, 250 ml","29,25 €"
Davines LOVE CURL Conditioner 250ml - Acondicionador elastificante y controlador para cabello ondulado o rizado - New Pak 2022,"22,25 €"
Davines Oi OIL Absolute Beautifying Potion 135 ml,"45,50 €"
"Davines Love Curl Controller - Crema para cabello, 150 ml","26,25 €"
Davines momo moisturizing conditioner (for dry or dehydrated hair) 250.,"22,25 €"
Davines Heart Of Glass Rich Acondicionador 250 Ml,"31,00 €"
Davines Davines Love Mask Rizo 250Ml 250 ml,"30,50 €"
Davines Essential Nounou Mask 250 Ml - 250 ml,"30,50 €"
Davines Tcc The Quick Fix Circle 50 Ml.,"10,00 €"
davines nourishing naturaltech shampoo 250 ml,"22,50 €"
Davines Essential Melu Shampoo 250 ml,"20,00 €"
Davines Tcc The Spotlight Circle 50 Ml.,"10,00 €"
Davines More Inside Medium Hold Modelling Gel 250ml,"23,50 €"
Davines Essential Champú Dede 295000 g,"20,00 €"
Davines Naturaltech Nourishing Shampoo 1000ml - Champú nutritivo,"54,25 €"
,
,
,
,
Davines essential haircare oi/shampoo - absolute beautifying shampoo.,"63,00 €"
Davines Natural Tech Renewing Shampoo (For All Scalp and Hair Types) 1000ml,"54,25 €"
"Davines - Leche protectora solar para el cabello SU Hair Milk, 135 ml","31,75 €"
Davines Essential Acondicionador Nounou 250 Ml - 250 ml,"22,25 €"
Davines – Nounou Nourishing Illuminating Shampoo – 250 ml/8.45oz by Davines,"20,00 €"
Davines Naturaltech Well-Being Shampoo 250ml,"22,50 €"
Davines Naturaltech Detoxifying Scrub Champú 250 ml,"22,50 €"
Davines Essential Mini Productos Mask Minu - 75 ml,"10,50 €"
Davines Essential Solu Champú 400 g (881-14861),"20,00 €"
Davines Solu Clarifying Champú - 1000 ml,"53,00 €"
"Natural Tech by Davines - Paquete nutritivo para el cabello, 250 ml","36,75 €"
Davines More inside Texturizing dust 8gr (12085),"28,00 €"
Davines Oi Acondicionador - 1000 ml,"90,25 €"
"Davines Minu - Acondicionador, 250 ml","22,25 €"
Davines Dede Delicate Ritual Shampoo 1000ml,"53,00 €"
Davines More Inside Sea Salt Spray - 250 ml,"24,25 €"
,
,
,
,
Davines Davines ntech mini productos champãº purificante 100 ml 1 Unidad 100 g,"11,25 €"
Davines Naturaltech Calming Shampoo 250ml,"22,50 €"
DAVINES NOURISHING VEGETARIAN MIRACLE ACONDICIONADOR 1000 ML,"84,25 €"
Davines Essential haircare Love curl revitalizer 75ml,"10,50 €"
- Davines - Alchemic. Champú dorado. Envase de 280 ml,"21,75 €"
Davines Nourishing Keratin Sealer 100 ml,"28,50 €"
Davines More inside Forming pomade 75ml,"27,50 €"
Davines Tcc The Purity Circle - 50 ml,"10,00 €"
"Davines Oi Liquid Luster, Tratamiento de enjuague nutritivo, Añadir brillo sin peso, 10.5 fl oz (17313)","39,25 €"
Davines Natural Tech Renewing - Tratamiento acondicionador para todo tipo de cabello y escalada (250 ml),"28,00 €"
Davines more inside volume boosting mousse 250ml.,"25,00 €"
Davines Alchemic Conditioner - # Tobacco (For Natural & Coloured Hair) 250ml,"30,50 €"
"Davines Volu Hair Mist - Cuidado capilar, 250 ml","33,00 €"
Davines alchemic system alchemic conditioner silver 250ml.,"30,50 €"
Davines Naturaltech Well Being Shampoo 1000 Ml - 100 ml,"54,25 €"
Davines More Inside Relaxing Moisturizing Fluid Crema - 125 ml,"21,25 €"
,
,
,
,
"DAVINES 75098-D Melu Champú, 1000 ml","53,00 €"
"Davines DEDEDEDE Barra de champú, 3.53 oz","23,50 €"
"Davines Dede Hair Mist - Cuidado capilar, 250 gr","31,75 €"
Davines Essential Melu Conditioner 250 Ml - 250 ml,"22,25 €"
Davines Heart Of Glass Sheer Glaze 150 Ml,"27,25 €"
Davines Melu Escudo - 250 ml.,"41,00 €"
DAVINES - NATURALTECH energizing gel 150 ml-unisex,"30,00 €"
Davines Alchemic Silver Champú 280 9460 g,"21,75 €"
Davines More Inside Invisible Serum Efecto Día Despues - 50 ml,"24,75 €"
Davines Tcc The Wake-Up Circle 50 Ml.,"10,00 €"
Davines Alchemic Shampoo - # Tobacco (For Natural & Coloured Hair) 280ml,"21,75 €"
Davines More Inside Medium Hold Pliable Paste - 125 ml,"28,00 €"
Davines Serum para El Cabello - 150 ml,"25,00 €"
Davines Naturaltech Love Curl Conditioner 75Ml - 75 ml,"10,50 €"
Davines oi shampoo 90ml - champú multibenefit.,"10,75 €"
Davines Essential haircare Love curl hair mask 75ml - mascarilla pelo rizado,"10,50 €"
,
,
,
,
Davines SU Milk 50ml - leche protectora y suavizante solar,"10,75 €"
"Davines Love Curl Primer - Leche nutritiva para cabello ondulado, 150 ml","28,50 €"
Davines Aceite Non Oil - 250 ml,"23,50 €"
Davines Naturaltech Well Being Acondicionador 150 ml,"21,25 €"
Davines-Champú Volu Davines formato viaje 75 ml,"10,50 €"
Davines Naturaltech Rebalance Shampoo 100Ml 100 ml,"11,25 €"
Davines Nounou Acondicionador 75 Ml.,"10,50 €"
Davines Essential Haircare Love Curl Cleansing Cream - 500 Ml,"35,50 €"
Davines This is a Curl Gel Oil 250ml New,"23,50 €"
"Davines - Acondicionador Minu - 91,44 l oz.","76,50 €"
Davines – Love Curl Shampoo Davines formato viaje 75 ml,"10,50 €"
davines NT renewing Conditioning Treatment 60 ml,"11,25 €"
Davines Alchemic Shampoo - # Copper (For Natural & Coloured Hair) 280ml,"21,75 €"
Davines Naturaltech Replumping Hair Filler Superactivo 100 ml,"35,00 €"
Davines SU Hair Mask 150ml - Mascarilla reparadora para después del sol,"27,50 €"
Davines Essential Acondicionador Love Disciplinante 1000 Ml - 1000 ml,"76,50 €"
,
,
,
,
Davines 69202 - Gel de ducha,"29,75 €"
Davines Essential hair care Love curl Conditioner 1000ml - Acondicionador disciplinante,"76,50 €"
Davines Naturaltech Nounou Shampoo 75Ml - 75 ml,"10,50 €"
davines – Dede Delicate Daily Conditioner (for All Hair types) 250 ml/8.45oz,"22,25 €"
Davines More inside Shine wax 75ml (13509),"26,25 €"
Davines Alchemic Silver Shampoo 1000ml,"51,25 €"
Davines Energizing Superactive Hair Serum 100ml,"79,00 €"
Davines A Single Champu 250 Ml.,"27,25 €"
Davines Essential Haircare Dede Acondicionador 75ml,"10,50 €"
Davines Su Champu Para Cabello&Cuerpo 75 200 g,"10,75 €"
"Daviness, Cuidado del pelo y del cuero cabelludo - 75 gr.","10,75 €"
Davines Alchemic Conditioner - # Golden (For Natural & Coloured Hair) 250ml,"30,50 €"
Davines Alchemic Red Champú 280 287370 g,"21,75 €"
Davines Alchemic Conditioner Red (For Natural & Red or Mahogany Hair) 250ml,"30,50 €"
Davines Heart of Glass Intense Treatment 750ml,"81,75 €"
Davines Naturaltech Energizing Thickening Hair Tonic 100ml,"43,50 €"
,
,
,
,
Davines Finest pigments No8 Light Blonde 280 ml,"64,25 €"
Davines Fitnest Pigments nº9 Very light Blonde/RubioClarisimo 280ml,"64,25 €"
"Daviness, Acondicionador de pelo - 75 gr.","10,50 €"
"Davines Naturaltech Calming Superactive - Cuidado capilar, 200 gr","47,25 €"
Natural Tech Replumping Conditioner (For All Hair Types) 1000ml/33.8oz,"66,00 €"
"Melu, Maquillaje corrector - 75 gr.","10,50 €"
Davines Finest Pigments Sand - Sabbia 280ml,"64,25 €"
Davines Alchemic Shampoo Chocolate 280ml - Champú Para Cabello Castaño Oscuro,"21,75 €"
Davines Alchemic System Alchemic Conditioner Chocolate 250ml,"30,50 €"
"Daviness, Cuidado del pelo y del cuero cabelludo - 250 ml","25,00 €"
Davines Naturaltech Calming Shampoo 1000 Ml - 100 ml,"54,25 €"
Davines Naturaltech Energizing Seasonal Superactive Hair Lotion 100ml,"83,00 €"
Davines Nounou Shampoo 400 g,"53,00 €"
Davines Alchemic Silver Conditioner 1000ml,"81,00 €"
Davines Aceite - 100 ml,"29,95 €"
Davines Dede Delicate Acondicionador - 1000 ml,"76,50 €"
,
,
,
,
"Daviness, Acondicionador de pelo - 75 gr.","10,50 €"
"Daviness, Filtro solar corporal - 75 gr.","10,50 €"
Davines Natural Tech Well-Being Acondicionador - 60 ml,"11,25 €"
Davines Finest Pigments #5 Castaño Claro 280 Ml - 280 ml,"64,25 €"
Momo Shampoo 1000 52000 g,"53,00 €"
Davines Naturaltech Calming Shampoo 100ml - Champú lenitivo,"11,25 €"
Davines NT Detoxifying Scrub Champú 100 ml,"11,25 €"
Davines Finest Pigments #Ash 280 Ml - 280 ml,"64,25 €"
"Daviness, Cuidado del pelo y del cuero cabelludo - 100 gr.","11,25 €"
Authentic Fórmulas Nourishing Oil R&C&C 140 Ml,"41,75 €"
Davines Solu Shampoo - 75 ml,"10,50 €"
Davines Essential Haircare Nounou Conditioner 1000ml/33.8oz (Salon Size) by Davines,"76,50 €"
"Daviness, Filtro solar corporal - 75 gr.","23,75 €"
Davines Naturaltech Tratamiento Anticaida Cabello 6 ml,"83,00 €"
"Daviness, Cuidado del pelo y del cuero cabelludo - 280 gr.","64,25 €"
Naturaltech Natural Tech Mini Productos Champú Energizante - 100 ml,"11,25 €"
,
,
,
,
Davines Finest Pigments #6 Rubio Oscuro 280 Ml - 280 ml,"64,25 €"
Davines Finest Pigments Red 280ml,"64,25 €"
Naturaltech Natural Tech Mini Productos Champú Replumping - 100 ml,"11,25 €"
Davines Davines Finest Pigments Copper 280Ml 280 ml,"64,25 €"
Davines naturaltech renewing serum superactive 100ml.,"54,00 €"
Davines Minu Illuminating Mascarilla para El Pelo - 1000 ml,"86,50 €"
Davines Natural Tech Detoxifying Scrub Shampoo (For Atonic Scalp) 1000ml,"54,25 €"
Davines Pasta&Love Pre Shaving & Beard Oil 50ml,"26,75 €"
davines – Natural de Tech Well Being Conditioner 1000 ml/33.8oz,"66,00 €"
"Daviness, Cuidado del pelo y del cuero cabelludo - 60 ml","11,25 €"
Davines More Inside Shimmering Mist - 200 ml,"23,75 €"
Davines Nourishing Vegetarian Miracle acondicionado 60 ml,"11,25 €"
Davines Natural Tech Well-Being Champú - 100 ml,"11,25 €"
Davines Fitnest Pigments Pearl/Perla 280ml,"64,25 €"
Skeyndor Essential Mini Productos Acondicionador Minu - 75 ml,"10,50 €"
Davines NT Nourishing Hair Building Pak 60 ml*,"11,25 €"
,
,
,
,
"DAVINES, Set de regalo de pelo - 400 ml.","26,75 €"
"davines Sobre aftersun aftersun para el rostro y el cuerpo, novedad 2018, 150 ml","35,00 €"
Davines Authentic Formulas Authentic Moisturising Balm 150ml,"23,75 €"
davines – Natural Tech renewing Conditioning Treatment (for All Scalp and Hair types) 1000 ml/33.81oz,"88,00 €"
"DAVINES, Set de regalo de pelo - 100 ml.","12,50 €"
Davines Fitnest Pigments nº4 Medium Brown/Castaño,"64,25 €"
Davines Elevating Clay Supercleanser 120g,"112,75 €"
Davines R Renewing Pro Boost Superactivo 500 Ml.,"65,90 €"
Davines Fitnest Pigments nº7 Blonde/Rubio Medio,"69,25 €"
Davines Concentrado - 500 ml,"17,00 €"
"Daviness, Acondicionador de pelo - 75 gr.","10,50 €"
Davines Nounou Nourishing Mascarilla para El Pelo - 1000 ml,"86,50 €"
"Daviness - Tinte con Extractos de Plantas, 280 ml, Mahogany/Mogano","64,25 €"
Natural Tech Rebalancing Shampoo (For Oily Scalp) 1000ml/33.8oz,"54,25 €"
"Daviness, Acondicionador de pelo - 125 gr.","21,25 €"
"Comfort Zone Agua micelar esencial – Botella de 200 ml – Elimina el maquillaje fácilmente – Para cara, ojos, labios – Limpia poros, refrescante, ingredientes naturales","31,50 €"
,
,
,
,
"Daviness, Cuidado del pelo y del cuero cabelludo - 280 gr.","64,25 €"
Curly Shine,"19,80 €"
"Daviness, Filtro solar corporal - 150 gr.","26,25 €"
Active pureness mask,"36,90 €"
Suero Sublime Skin Oil de Comfort Zone.,"110,70 €"
Comfort Zone Sublime - Crema de aceite para la piel (1 unidad),"123,30 €"
"Daviness, Acondicionador de pelo - 75 gr.","10,50 €"
Su Crema Protectora Spf30 Cara y Cuerpo 100 ml,"31,25 €"
Comfort zone Aromasoul - Gel de ducha (200 ml),"25,20 €"
Comfort Zone Essential - Desmaquillador bifásico,"32,40 €"
"Comfort Zone Aromasoul - Crema corporal mediterránea, 200 ml","40,50 €"
Body Strategist Leg Gel 200 Ml,"52,20 €"
Comfort zone Active Pureness gel,"39,60 €"
Momo Hair Potion Moisturizing Universal Cream (For Dry or Dehydrated Hair) 150ml/5.07oz,"26,75 €"
Comfort Zone Essential Care Toner Limpiador - 200 ml,"30,60 €"
Comfort Zone Sublime Skin Essence 100 ml,"68,40 €"
,
,
,
,
Comfort Zone Tranquillity Shower Crema - 200 ml,"34,20 €"
Comfort Zone Sublime Skin Crema - 60 ml,"120,60 €"
Comfort Zone Tranquillity Blend Tratamiento Corporal - 50 ml,"81,90 €"
Skin Regimen Microalgae Essence 100 ml,"62,10 €"
Comfort Zone Renight MASK -60 ml,"65,70 €"
Comfort Zone - Active Pureness Corrector,"35,10 €"
Comfort Zone Sublime Skin Mascarilla de Ojos - 6 Unidades,"69,30 €"
"Comfort Zone, Crema corporal - 200 ml.","68,40 €"
Comfort Zone - Active Pureness Hydra Fluid,"45,90 €"
Comfort Zone Sun Soul Oil SPF 6 Aceite Corporal - 150 ml,"39,00 €"
Comfort Zone Tranquillity Body Crema - 180 ml,"83,70 €"
COMFORT ZONE Hydramemory Serum 30 ml,"66,60 €"
"Redken | Champú Sin Sulfatos para Fortalecer todo tipo de Cabellos, Acidic Bonding Concentrate, 300 ml","27,95 €"
Comfort Zone Sun Soul Face SPF 30 Crema - 60 ml,"34,00 €"
"Comfort Zone, Crema y leche facial - 25 ml.","93,60 €"
BODY STRATEGIST cream 200 ml,"69,30 €"
,
,
,
,
Comfort Zone Essential Care Toner Limpiador - 200 ml,"30,60 €"
"Comfort Zone, Loción corporal - 200 ml.","36,00 €"
Comfort Zone Remedy Cream Tratamiento Facial - 60 ml,"63,90 €"
Comfort Zone Hydramemory Cream Gel Tratamiento Facial - 60 ml,"73,80 €"
Comfort Zone Hydramemory Cream Tratamiento Facial - 60 ml,"73,80 €"
Comfort Zone Hydramemory Eye Gel Contorno de Ojos - 15 ml,"35,10 €"
"Comfort Zone, Crema y leche facial - 50 ml.","102,60 €"
Comfort Zone Remedy Cream To Oil Limpiador Facial - 150 ml,"43,20 €"
Comfort Zone Renight Crema - 60 ml,"77,40 €"
"Redken | Champú Protector del Color Para Cabellos Coloreados, Color Extend Magnetics, 300ml","19,90 €"
Comfort Zone Tranquillity Body Loción - 200 ml,"52,20 €"
Comfort Zone Essential Care Limpiador Facial - 150 ml,"29,70 €"
"Fanola, Cuidado del pelo y del cuero cabelludo - 1 unidad","18,00 €"
Comfort Zone Sublime Skin Suero - 30 ml,"110,70 €"
Comfort Zone Tranquillity Bath & Body Oil Aceite - 200 ml,"89,10 €"
Comfort Zone Sublime Skin Rich Cream Tratamiento Facial - 60 ml,"120,88 €"
,
,
,
,
Sublime Skin Mascarilla elevadora.,"86,40 €"
Comfort Zone Sublime Skin Crema de Ojos - 15 ml,"69,30 €"
Comfort Zone Sun Soul Aftersun Face Cream 60 Ml 60 ml,"37,40 €"
"Redken | Champú Hidratante con Aceite de Argán para Cabello Seco y Frágil, All Soft, 300 ml","21,95 €"
,
,
,
,
Comfort Zone Sun Soul Face SPF 30 Crema - 60 ml,"34,00 €"
Comfort Zone Hydramemory Cream Tratamiento Facial - 60 ml,"73,80 €"
Comfort Zone Hydramemory Cream Gel Tratamiento Facial - 60 ml,"73,80 €"
Comfort Zone Hydramemory Eye Gel Contorno de Ojos - 15 ml,"35,10 €"
Comfort Zone Essential Care Toner Limpiador - 200 ml,"30,60 €"
"Comfort Zone Manteca Corporal Sacred Nature, Fragancia Natural, 7,67 Oz, Almond","66,60 €"
Comfort Zone Essential Care Limpiador Facial - 150 ml,"29,70 €"
Comfort Zone Sun Soul Aftersun Face Cream 60 Ml 60 ml,"37,40 €"
Comfort Zone Remedy Cream To Oil Limpiador Facial - 150 ml,"43,20 €"
COMFORT ZONE SACRED NATURE CLEANSING BALM 110 ML,"42,30 €"
Comfort Zone Tranquillity Body Loción - 200 ml,"52,20 €"
Comfort Zone Renight Crema - 60 ml,"77,40 €"
Comfort Zone Sublime Skin Crema de Ojos - 15 ml,"69,30 €"
Comfort Zone Sublime Skin Rich Cream Tratamiento Facial - 60 ml,"120,88 €"
Comfort Zone Sublime Skin Suero - 30 ml,"110,70 €"
Comfort Zone Tranquillity Bath & Body Oil Aceite - 200 ml,"89,10 €"
,
,
,
,
Comfort Zone - Active Pureness Hydra Fluid,"45,90 €"
Comfort Zone Remedy Cream Tratamiento Facial - 60 ml,"63,90 €"
COMFORT ZONE Hydramemory Serum 30 ml,"66,60 €"
REMEDY toner 200 ml,"41,40 €"
Comfort Zone Tranquillity Body Crema - 180 ml,"83,70 €"
BODY STRATEGIST cream 200 ml,"69,30 €"
"Comfort Zone, Loción corporal - 200 ml.","45,00 €"
"Comfort Zone, Sun Soul Milk Kids Spray SPF50+ 150 ml","49,50 €"
Essential Care Face Wash 150 Ml,"33,00 €"
"Comfort Zone Agua micelar esencial – Botella de 200 ml – Elimina el maquillaje fácilmente – Para cara, ojos, labios – Limpia poros, refrescante, ingredientes naturales","31,50 €"
Comfort Zone Sun Soul Oil SPF 6 Aceite Corporal - 150 ml,"39,00 €"
ESSENTIAL CARE peeling 60 ml,"36,00 €"
"Comfort Zone, Crema y leche facial - 50 ml.","102,60 €"
Comfort Zone Tranquillity Shower Crema - 200 ml,"34,20 €"
"Comfort Zone Aromasoul - Crema corporal mediterránea, 200 ml","40,50 €"
"Comfort Zone, Sun Soul Face & Body Aftersun 200 ml.","42,50 €"
,
,
,
,
Comfort Zone Sublime Skin Essence 100 ml,"68,40 €"
Comfort Zone Tranquillity Blend Tratamiento Corporal - 50 ml,"81,90 €"
"Comfort Zone, Crema corporal - 200 ml.","68,40 €"
Comfort Zone Water Soul Aftersun Aloe Gel 150 Ml 150 ml,"30,00 €"
COMFORT ZONE Sublime Skin Corrector 30 ml,"53,10 €"
Comfort Zone SACRED NATURE youth serum 30 ml,"77,40 €"
"Comfort Zone, Sun Soul Lk Spray SPF20 150 ml","40,50 €"
Comfort Zone Sublime Skin Crema - 60 ml,"120,60 €"
ESSENTIAL scrub 60 ml,"36,00 €"
Comfort Zone Máscara Exfoliante de Naturaleza Sagrada,"50,40 €"
COMFORT ZONE SKIN REGIMEN ROLLON 10 ML,"17,10 €"
Comfort Zone Renight MASK -60 ml,"65,70 €"
Comfort Zone Sublime - Crema de aceite para la piel (1 unidad),"123,30 €"
Comfort Zone - Active Pureness Corrector,"35,10 €"
Comfort Zone Sublime Skin Mascarilla de Ojos - 6 Unidades,"69,30 €"
Comfort Zone Sagrada Naturaleza Hydra Crema,"79,20 €"
,
,
,
,
Comfort Zone Sacred Nature Jabón para manos y cuerpo,"27,90 €"
Comfort Zone Water Soul Eco Shower Gel 200 Ml 200 ml,"31,00 €"
Comfort Zone Skin Regimen Hand Cream 75 ml - Comfort Zone,"22,50 €"
COMFORT ZONE SKIN REGIMEN AMBIENCE SPRAY 200 ML,"45,00 €"
Comfort zone Aromasoul - Gel de ducha (200 ml),"25,20 €"
Comfort Zone Essential - Desmaquillador bifásico,"32,40 €"
"Comfort Zone, Loción corporal - 100 ml.","53,10 €"
Comfort Zone – Tulsi Booster 25 ml,"91,80 €"
"Comfort Zone SKIN REGIMEN 15.0 VITAMIN C BOOSTER 21,2 ML + 4 GR","91,80 €"
Comfort Zone Essential Care Mascara - 10 ml,"27,00 €"
comfort zone Tranquilidad,"40,50 €"
Suero Sublime Skin Oil de Comfort Zone.,"110,70 €"
"Comfort Zone, Crema y leche facial - 25 ml.","93,60 €"
"Comfort Zone, Sun Soul - Gel de ducha 2 en 1, 200 ml","32,50 €"
"Comfort Zone, Sun Soul Lk Spray SPF30 150 ml","43,00 €"
Comfort Zone Specialist Hand Oil 15ml,"34,20 €"
,
,
,
,
"Comfort Zone, Crema facial Sun Soul FPS 30, 60 ml.","38,00 €"
Comfort zone Active Pureness gel,"39,60 €"
"Comfort Zone, Loción corporal - 200 ml.","36,00 €"
BODY STRATEGIST scrub 200 ml,"45,90 €"
Body Strategist Leg Gel 200 Ml,"52,20 €"
SUN SOUL milk SPF15 150 ml,"39,00 €"
BODY STRATEGIST oil 100 ml,"61,20 €"
HYDRAMEMORY mask 60 ml,"48,60 €"
Sublime Skin Mascarilla elevadora.,"86,40 €"
Skin Regimen Urban Shield SPF30 40 ml,"63,90 €"
Skin Regimen Microalgae Essence 100 ml,"62,10 €"
Active pureness mask,"36,90 €"
SUBLIME SKIN peel pad 14 pz,"52,27 €"
ComforZone Body Strategist - Baños de Montalcino - Barro con agua termal,"53,10 €"
Remedy Aceite.,"57,60 €"
Skin Regimen HA Booster 25 ml,"91,80 €"
,
,
,
,
SUN SOUL milk SPF30 150 ml,"39,00 €"
"Zona de confort tranquilidad vela 150g. 5,3 oz","36,00 €"
,
,
,
