fecha,imagen,nombre,distribuidor,precio
14-04-2023,https://m.media-amazon.com/images/I/71wmKzvGLML._AC_UY218_.jpg,davines naturaltech shampoing energizing 250ml.,CorradoEquipe,"24,02 €"
14-04-2023,https://m.media-amazon.com/images/I/71XAYvBZTkL._AC_UY218_.jpg,davines heart of glass silkening champu 250 ml,CorradoEquipe,"20,00 €"
14-04-2023,https://m.media-amazon.com/images/I/71IXlMO4HRL._AC_UY218_.jpg,davines love smooth mask 250ml disciplinante nuevo formato,CorradoEquipe,"25,90 €"
14-04-2023,https://m.media-amazon.com/images/I/614MHILl3bL._AC_UY218_.jpg,"davines volu - champú, 250 ml",CorradoEquipe,"20,50 €"
14-04-2023,https://m.media-amazon.com/images/I/61frKUCrCDL._AC_UY218_.jpg,davines heart of glass rich acondicionador 250 ml,CorradoEquipe,"32,50 €"
14-04-2023,https://m.media-amazon.com/images/I/617LFfN0y2L._AC_UY218_.jpg,davines essential solu champú 400 g (881-14861),CorradoEquipe,"24,00 €"
14-04-2023,https://m.media-amazon.com/images/I/71m++AbY9-L._AC_UY218_.jpg,davines love smoothing conditioner - acondicionador suavizante para cabellos rebeldes 250ml - new formula 2022,CorradoEquipe,"24,95 €"
14-04-2023,https://m.media-amazon.com/images/I/81rPSzWE1YL._AC_UY218_.jpg,davines naturaltech renewing shampoo 250ml - champù de longevidad todo.,CorradoEquipe,"22,42 €"
14-04-2023,https://m.media-amazon.com/images/I/61L3TxAWYWL._AC_UY218_.jpg,davines naturaltech calming shampoo 250ml,CorradoEquipe,"25,59 €"
14-04-2023,https://m.media-amazon.com/images/I/814Az5MT9xL._AC_UY218_.jpg,davines naturaltech replumping hair filler superactivo 100 ml,CorradoEquipe,"39,60 €"
14-04-2023,https://m.media-amazon.com/images/I/81DpKjyy8+L._AC_UY218_.jpg,davines naturaltech renewing conditioning treatment 250ml - acondicion.,CorradoEquipe,"28,30 €"
14-04-2023,https://m.media-amazon.com/images/I/81rSIbr2v9L._AC_UY218_.jpg,"davines 69230 - champú, 250 ml",CorradoEquipe,"25,53 €"
14-04-2023,https://m.media-amazon.com/images/I/51oj72l8V+L._AC_UY218_.jpg,davines love acondicionador taming enchancing curl - 250 ml (paquete de 1),CorradoEquipe,"22,40 €"
14-04-2023,https://m.media-amazon.com/images/I/61cid+W5wCL._AC_UY218_.jpg,davines this is a curl gel oil 250ml new,CorradoEquipe,"34,62 €"
14-04-2023,https://m.media-amazon.com/images/I/91J036FcEYL._AC_UY218_.jpg,davines more inside forming pomade 75ml,CorradoEquipe,"24,50 €"
14-04-2023,https://m.media-amazon.com/images/I/71YTZdSpIXL._AC_UY218_.jpg,davines energizing superactive hair serum 100ml,CorradoEquipe,"74,50 €"
14-04-2023,https://m.media-amazon.com/images/I/71aMsFzcohL._AC_UY218_.jpg,"davines natural tech energizing gel (for scalp & fragile, thinning hai.",CorradoEquipe,"35,70 €"
14-04-2023,https://m.media-amazon.com/images/I/31WfmI0AeIL._AC_UY218_.jpg,"davines, set de regalo de pelo - 400 ml.",CorradoEquipe,"27,50 €"
14-04-2023,https://m.media-amazon.com/images/I/71kTypzJCUL._AC_UY218_.jpg,"davines dededede barra de champú, 3.53 oz",CorradoEquipe,"18,70 €"
14-04-2023,https://m.media-amazon.com/images/I/71eUK8V6OGL._AC_UY218_.jpg,davines naturaltech energizing seasonal superactive hair lotion 100ml,CorradoEquipe,"77,80 €"
14-04-2023,https://m.media-amazon.com/images/I/51z18aFaY+L._AC_UY218_.jpg,"daviness, cuidado del pelo y del cuero cabelludo - 60 ml",CorradoEquipe,"16,50 €"
14-04-2023,https://m.media-amazon.com/images/I/71edqAexSeL._AC_UY218_.jpg,davines authentic fórmulas cleansing nectar c&c - 280 ml,CorradoEquipe,"24,80 €"
14-04-2023,https://m.media-amazon.com/images/I/61Sk9fwSlGL._AC_UY218_.jpg,"daviness, acondicionador de pelo - 75 gr.",CorradoEquipe,"12,50 €"
14-04-2023,https://m.media-amazon.com/images/I/717j3O4NbpL._AC_UY218_.jpg,"davines we stand for regeneration - lavado para el cabello y el cuerpo de edición limitada, 8.45 onzas líquidas",CorradoEquipe,"18,80 €"
14-04-2023,https://m.media-amazon.com/images/I/61WZVvH5WTS._AC_UY218_.jpg,"davines soporte para barra de champú, 1 ct.",CorradoEquipe,"12,50 €"
